{
  "schema_version": "1.0",
  "kind": "pr-state",
  "id": "synthetic-example",
  "plan_id": "PLAN-001",
  "run_id": "synthetic-example",
  "repository": "synthetic-example",
  "number": null,
  "url": null,
  "status": "prepared",
  "base_branch": "synthetic-example",
  "head_branch": "synthetic-example",
  "observed_base_oid": null,
  "observed_head_oid": null,
  "required_checks": [],
  "checks": [],
  "review_decision": "unknown",
  "merge_oid": null,
  "authorization_refs": [],
  "operation_id": "synthetic-example",
  "last_observed_at": null
}
